CREATE TABLE t_implicit_default (
id INT PRIMARY KEY,
val_double DOUBLE NOT NULL,
val_complex COMPLEX NOT NULL
);
INSERT INTO t_implicit_default VALUES (1, 3.14, '(1.0,2.0)');
UPDATE IGNORE t_implicit_default SET val_double = NULL, val_complex = NULL WHERE id = 1;
Warnings:
Warning	1048	Column 'val_double' cannot be null
Warning	1048	Column 'val_complex' cannot be null
SELECT * FROM t_implicit_default;
id	val_double	val_complex
1	0	(0,0)
DROP TABLE t_implicit_default;
CREATE TABLE t1 (
id INT PRIMARY KEY,
val COMPLEX NOT NULL,
name VARCHAR(50)
);
INSERT INTO t1 VALUES
(1, '(1.0,2.0)', 'one'),
(2, '(0,0)', 'two'),
(3, '(-3.5,4.5)', 'three'),
(4, '(5.0,-6.0)', 'four'),
(5, '(7.0,8.0)', 'five'),
(6, '(9.0,10.0)', 'six');
UPDATE t1 SET val = NULL WHERE id = 1;
ERROR 23000: Column 'val' cannot be null
SELECT * FROM t1 ORDER BY id;
id	val	name
1	(1,2)	one
2	(0,0)	two
3	(-3.5,4.5)	three
4	(5,-6)	four
5	(7,8)	five
6	(9,10)	six
UPDATE IGNORE t1 SET val = NULL WHERE id = 1;
Warnings:
Warning	1048	Column 'val' cannot be null
SELECT * FROM t1 ORDER BY id;
id	val	name
1	(0,0)	one
2	(0,0)	two
3	(-3.5,4.5)	three
4	(5,-6)	four
5	(7,8)	five
6	(9,10)	six
UPDATE IGNORE t1 SET name = NULL WHERE id = 1;
SELECT * FROM t1 ORDER BY id;
id	val	name
1	(0,0)	NULL
2	(0,0)	two
3	(-3.5,4.5)	three
4	(5,-6)	four
5	(7,8)	five
6	(9,10)	six
UPDATE IGNORE t1 SET val = NULL WHERE id IN (3, 4);
Warnings:
Warning	1048	Column 'val' cannot be null
Warning	1048	Column 'val' cannot be null
SELECT * FROM t1 ORDER BY id;
id	val	name
1	(0,0)	NULL
2	(0,0)	two
3	(0,0)	three
4	(0,0)	four
5	(7,8)	five
6	(9,10)	six
UPDATE IGNORE t1 SET val = NULL;
Warnings:
Warning	1048	Column 'val' cannot be null
Warning	1048	Column 'val' cannot be null
Warning	1048	Column 'val' cannot be null
Warning	1048	Column 'val' cannot be null
Warning	1048	Column 'val' cannot be null
Warning	1048	Column 'val' cannot be null
SELECT * FROM t1 ORDER BY id;
id	val	name
1	(0,0)	NULL
2	(0,0)	two
3	(0,0)	three
4	(0,0)	four
5	(0,0)	five
6	(0,0)	six
DROP TABLE t1;
