CREATE TABLE t1 (
id INT PRIMARY KEY,
val COMPLEX
);
INSERT INTO t1 VALUES (1, '(1.0,2.0)'), (2, '(3.0,4.0)');
UPDATE t1 SET val = CONCAT('(', '5.0', ',', '6.0', ')') WHERE id = 1;
ERROR HY000: Incorrect COMPLEX value: cannot implicitly cast string expression. Use explicit conversion for column 'val' at row 1
SELECT * FROM t1 ORDER BY id;
id	val
1	(1,2)
2	(3,4)
UPDATE t1 SET val = VSQL_COMPLEX.COMPLEX::from_string(CONCAT('(', '5.0', ',', '6.0', ')')) WHERE id = 1;
SELECT * FROM t1 ORDER BY id;
id	val
1	(5,6)
2	(3,4)
DROP TABLE t1;
