INSTALL EXTENSION VSQL_BLOOM_HIDDEN_TEST;
CREATE TABLE t (
id INT PRIMARY KEY,
bucket INT NOT NULL
);
CREATE INDEX idx_bucket ON t (bucket)
USING EXTENDED(bloom);
SELECT bloom_create() AS inspector_created;
inspector_created
1
INSERT INTO t VALUES (1, 10), (2, 10);
SELECT bloom_load_cache() AS loaded_after_insert;
loaded_after_insert
2
SELECT bloom_search(10) AS bucket_10_after_insert;
bucket_10_after_insert
1,2
DELETE FROM t WHERE id = 1;
SELECT bloom_load_cache() AS loaded_after_delete;
loaded_after_delete
1
SELECT bloom_search(10) AS bucket_10_after_delete;
bucket_10_after_delete
2
UPDATE t SET bucket = 20 WHERE id = 2;
SELECT bloom_load_cache() AS loaded_after_update;
loaded_after_update
1
SELECT bloom_search(10) AS bucket_10_after_update;
bucket_10_after_update

SELECT bloom_search(20) AS bucket_20_after_update;
bucket_20_after_update
2
DROP TABLE t;
SELECT bloom_drop() AS dropped;
dropped
1
UNINSTALL EXTENSION VSQL_BLOOM_HIDDEN_TEST;
