# Install the variable-length bit field extension.
INSTALL EXTENSION vsql_bitfield_test;
SELECT extension_name, extension_version FROM INFORMATION_SCHEMA.EXTENSIONS;
EXTENSION_NAME	EXTENSION_VERSION
vsql_bitfield_test	0.0.1
# A column declared in the bare form. resolve_params fills in the default
# 'max_number_of_bits', so the column stores explicit canonical params.
CREATE TABLE bits (
id INT PRIMARY KEY,
b vsql_bitfield_test.BITFIELD
);
SHOW CREATE TABLE bits;
Table	Create Table
bits	CREATE TABLE `bits` (
  `id` int NOT NULL,
  `b` vsql_bitfield_test.BITFIELD('max_number_of_bits=4096') DEFAULT NULL,
  PRIMARY KEY (`id`)
) ENGINE=InnoDB DEFAULT CHARSET=utf8mb4 COLLATE=utf8mb4_0900_ai_ci
# Bit fields of DIFFERENT bit lengths coexist in the same column.
INSERT INTO bits VALUES (1, '1');
INSERT INTO bits VALUES (2, '101');
INSERT INTO bits VALUES (3, '11110000');
INSERT INTO bits VALUES (4, '1010101010101010');
INSERT INTO bits VALUES (5, '');
# The bare column carries known params, so it can be passed to functions.
# bitfield_length reports the number of bits; bitfield_popcount the number
# of set bits. A 16-bit value is packed into 2 bytes, not 16.
SELECT id, b,
vsql_bitfield_test.bitfield_length(b) AS nbits,
vsql_bitfield_test.bitfield_popcount(b) AS nset
FROM bits ORDER BY id;
id	b	nbits	nset
1	1	1	1
2	101	3	2
3	11110000	8	4
4	1010101010101010	16	8
5		0	0
# Predicate comparisons use the type's bit-by-bit compare across
# different lengths.
SELECT id FROM bits WHERE b > '1' ORDER BY id;
id
2
3
4
SELECT id FROM bits WHERE b = '11110000' ORDER BY id;
id
3
# UPDATE may grow or shrink the bit length.
UPDATE bits SET b = '111' WHERE id = 1;
SELECT id, b, vsql_bitfield_test.bitfield_length(b) AS nbits
FROM bits WHERE id = 1;
id	b	nbits
1	111	3
# A character other than '0'/'1' is rejected by from_string.
INSERT INTO bits VALUES (6, '1021');
ERROR HY000: Incorrect BITFIELD value: '1021' for column 'b' at row 1
# The integer-length form is rejected: the type provides resolve_params
# but not int_to_params, so it does not accept a length specification.
CREATE TABLE bad_bits (b vsql_bitfield_test.BITFIELD(5));
ERROR 42000: Type 'vsql_bitfield_test.BITFIELD' does not accept a length specification near 'vsql_bitfield_test.BITFIELD(5))' at line 1
# The 'max_number_of_bits' parameter caps the column. Values within the
# cap are stored; a value exceeding it is rejected by from_string.
CREATE TABLE capped (
id INT PRIMARY KEY,
b vsql_bitfield_test.BITFIELD('max_number_of_bits=8')
);
SHOW CREATE TABLE capped;
Table	Create Table
capped	CREATE TABLE `capped` (
  `id` int NOT NULL,
  `b` vsql_bitfield_test.BITFIELD('max_number_of_bits=8') DEFAULT NULL,
  PRIMARY KEY (`id`)
) ENGINE=InnoDB DEFAULT CHARSET=utf8mb4 COLLATE=utf8mb4_0900_ai_ci
INSERT INTO capped VALUES (1, '10101010');
INSERT INTO capped VALUES (2, '101010101');
ERROR HY000: Incorrect BITFIELD value: '101010101' for column 'b' at row 1
SELECT id, b, vsql_bitfield_test.bitfield_length(b) AS nbits
FROM capped ORDER BY id;
id	b	nbits
1	10101010	8
# A different max_number_of_bits is a distinct parameterization, so an
# insert across the two columns is rejected regardless of bit count.
CREATE TABLE capped10 (
id INT PRIMARY KEY,
b vsql_bitfield_test.BITFIELD('max_number_of_bits=10')
);
INSERT INTO capped10 VALUES (1, '1010101010');
INSERT INTO capped10 VALUES (2, '101');
INSERT INTO capped (id, b) SELECT id + 100, b FROM capped10 WHERE id = 1;
ERROR HY000: Cannot implicitly cast from vsql_bitfield_test.BITFIELD('max_number_of_bits=10') to vsql_bitfield_test.BITFIELD('max_number_of_bits=8') for column 'b' at row 1
INSERT INTO capped (id, b) SELECT id + 100, b FROM capped10 WHERE id = 2;
ERROR HY000: Cannot implicitly cast from vsql_bitfield_test.BITFIELD('max_number_of_bits=10') to vsql_bitfield_test.BITFIELD('max_number_of_bits=8') for column 'b' at row 1
# An out-of-range cap is rejected by resolve_params at parse time.
CREATE TABLE bad_cap (b vsql_bitfield_test.BITFIELD('max_number_of_bits=0'));
ERROR 42000: BITFIELD 'max_number_of_bits' must be a positive integer <= 4096 near 'vsql_bitfield_test.BITFIELD('max_number_of_bits=0'))' at line 1
# Clean up.
DROP TABLE bits;
DROP TABLE capped;
DROP TABLE capped10;
UNINSTALL EXTENSION vsql_bitfield_test;
SELECT extension_name, extension_version FROM INFORMATION_SCHEMA.EXTENSIONS;
EXTENSION_NAME	EXTENSION_VERSION
