CREATE TABLE t1 (
id INT PRIMARY KEY,
value COMPLEX
);
INSERT INTO t1 VALUES (1, '(1.0,2.0)');
INSERT INTO t1 VALUES (2, NULL);
SHOW CREATE TABLE t1;
Table	Create Table
t1	CREATE TABLE `t1` (
  `id` int NOT NULL,
  `value` vsql_complex.COMPLEX DEFAULT NULL,
  PRIMARY KEY (`id`)
) ENGINE=InnoDB DEFAULT CHARSET=utf8mb4 COLLATE=utf8mb4_0900_ai_ci
SELECT * FROM t1 ORDER BY id;
id	value
1	(1,2)
2	NULL
ALTER TABLE t1 MODIFY COLUMN value COMPLEX NOT NULL DEFAULT '(-2.0,-3.0)';
ERROR 22004: Invalid use of NULL value
DELETE FROM t1 WHERE id=2;
ALTER TABLE t1 MODIFY COLUMN value COMPLEX NOT NULL DEFAULT '(-2.0,-3.0)';
SHOW CREATE TABLE t1;
Table	Create Table
t1	CREATE TABLE `t1` (
  `id` int NOT NULL,
  `value` vsql_complex.COMPLEX NOT NULL DEFAULT '(-2,-3)',
  PRIMARY KEY (`id`)
) ENGINE=InnoDB DEFAULT CHARSET=utf8mb4 COLLATE=utf8mb4_0900_ai_ci
INSERT INTO t1 VALUES (3, NULL);
ERROR 23000: Column 'value' cannot be null
SELECT * FROM t1 ORDER BY id;
id	value
1	(1,2)
INSERT IGNORE INTO t1 (id) VALUES (4);
SELECT * FROM t1 ORDER BY id;
id	value
1	(1,2)
4	(-2,-3)
DROP TABLE t1;
include/rpl/deprecated/show_binlog_events.inc
Log_name	Pos	Event_type	Server_id	End_log_pos	Info
#	#	Query	#	#	use `test`; CREATE TABLE `t1` (
  `id` int NOT NULL,
  `value` vsql_complex.COMPLEX DEFAULT NULL,
  PRIMARY KEY (`id`)
)
#	#	Query	#	#	BEGIN
#	#	Table_map	#	#	table_id: # (test.t1)
#	#	Write_rows	#	#	table_id: # flags: STMT_END_F
#	#	Xid	#	#	COMMIT /* XID */
#	#	Query	#	#	BEGIN
#	#	Table_map	#	#	table_id: # (test.t1)
#	#	Write_rows	#	#	table_id: # flags: STMT_END_F
#	#	Xid	#	#	COMMIT /* XID */
#	#	Query	#	#	BEGIN
#	#	Table_map	#	#	table_id: # (test.t1)
#	#	Delete_rows	#	#	table_id: # flags: STMT_END_F
#	#	Xid	#	#	COMMIT /* XID */
#	#	Query	#	#	use `test`; ALTER TABLE t1 MODIFY COLUMN value COMPLEX NOT NULL DEFAULT '(-2.0,-3.0)'
#	#	Query	#	#	BEGIN
#	#	Table_map	#	#	table_id: # (test.t1)
#	#	Write_rows	#	#	table_id: # flags: STMT_END_F
#	#	Xid	#	#	COMMIT /* XID */
#	#	Query	#	#	use `test`; DROP TABLE `t1` /* generated by server */
