CREATE TABLE t1 (
id INT PRIMARY KEY,
value COMPLEX
);
INSERT INTO t1 VALUES (1, '(1.0,2.0)');
INSERT INTO t1 VALUES (2, NULL);
SELECT * FROM t1 ORDER BY id;
id	value
1	(1,2)
2	NULL
ALTER TABLE t1 MODIFY COLUMN value COMPLEX NOT NULL;
ERROR 22004: Invalid use of NULL value
SELECT * FROM t1 ORDER BY id;
id	value
1	(1,2)
2	NULL
UPDATE t1 SET value='(-2.0,-3.0)' WHERE id=2;
ALTER TABLE t1 MODIFY COLUMN value COMPLEX NOT NULL;
SELECT * FROM t1 ORDER BY id;
id	value
1	(1,2)
2	(-2,-3)
DROP TABLE t1;
include/rpl/deprecated/show_binlog_events.inc
Log_name	Pos	Event_type	Server_id	End_log_pos	Info
#	#	Query	#	#	use `test`; CREATE TABLE `t1` (
  `id` int NOT NULL,
  `value` vsql_complex.COMPLEX DEFAULT NULL,
  PRIMARY KEY (`id`)
)
#	#	Query	#	#	BEGIN
#	#	Table_map	#	#	table_id: # (test.t1)
#	#	Write_rows	#	#	table_id: # flags: STMT_END_F
#	#	Xid	#	#	COMMIT /* XID */
#	#	Query	#	#	BEGIN
#	#	Table_map	#	#	table_id: # (test.t1)
#	#	Write_rows	#	#	table_id: # flags: STMT_END_F
#	#	Xid	#	#	COMMIT /* XID */
#	#	Query	#	#	BEGIN
#	#	Table_map	#	#	table_id: # (test.t1)
#	#	Update_rows	#	#	table_id: # flags: STMT_END_F
#	#	Xid	#	#	COMMIT /* XID */
#	#	Query	#	#	use `test`; ALTER TABLE t1 MODIFY COLUMN value COMPLEX NOT NULL
#	#	Query	#	#	use `test`; DROP TABLE `t1` /* generated by server */
