CREATE TABLE t1 (
id INT PRIMARY KEY,
complex_val COMPLEX
);
INSERT INTO t1 VALUES (1, '(1.0,2.0)');
INSERT INTO t1 VALUES (2, '(3.5,-1.2)');
INSERT INTO t1 VALUES (3, NULL);
SHOW CREATE TABLE t1;
Table	Create Table
t1	CREATE TABLE `t1` (
  `id` int NOT NULL,
  `complex_val` vsql_complex.COMPLEX DEFAULT NULL,
  PRIMARY KEY (`id`)
) ENGINE=InnoDB DEFAULT CHARSET=utf8mb4 COLLATE=utf8mb4_0900_ai_ci
SELECT * FROM t1 ORDER BY id;
id	complex_val
1	(1,2)
2	(3.5,-1.2)
3	NULL
ALTER TABLE t1 CHANGE complex_val string_val VARCHAR(100) NOT NULL;
ERROR 01000: Data truncated for column 'string_val' at row 3
SHOW CREATE TABLE t1;
Table	Create Table
t1	CREATE TABLE `t1` (
  `id` int NOT NULL,
  `complex_val` vsql_complex.COMPLEX DEFAULT NULL,
  PRIMARY KEY (`id`)
) ENGINE=InnoDB DEFAULT CHARSET=utf8mb4 COLLATE=utf8mb4_0900_ai_ci
SELECT * FROM t1 ORDER BY id;
id	complex_val
1	(1,2)
2	(3.5,-1.2)
3	NULL
UPDATE t1 SET complex_val='(2.0,-3.0)' WHERE id=3;
ALTER TABLE t1 CHANGE complex_val string_val VARCHAR(99) NOT NULL;
SHOW CREATE TABLE t1;
Table	Create Table
t1	CREATE TABLE `t1` (
  `id` int NOT NULL,
  `string_val` varchar(99) NOT NULL,
  PRIMARY KEY (`id`)
) ENGINE=InnoDB DEFAULT CHARSET=utf8mb4 COLLATE=utf8mb4_0900_ai_ci
SELECT * FROM t1 ORDER BY id;
id	string_val
1	(1,2)
2	(3.5,-1.2)
3	(2,-3)
DROP TABLE t1;
include/rpl/deprecated/show_binlog_events.inc
Log_name	Pos	Event_type	Server_id	End_log_pos	Info
#	#	Query	#	#	use `test`; CREATE TABLE `t1` (
  `id` int NOT NULL,
  `complex_val` vsql_complex.COMPLEX DEFAULT NULL,
  PRIMARY KEY (`id`)
)
#	#	Query	#	#	BEGIN
#	#	Table_map	#	#	table_id: # (test.t1)
#	#	Write_rows	#	#	table_id: # flags: STMT_END_F
#	#	Xid	#	#	COMMIT /* XID */
#	#	Query	#	#	BEGIN
#	#	Table_map	#	#	table_id: # (test.t1)
#	#	Write_rows	#	#	table_id: # flags: STMT_END_F
#	#	Xid	#	#	COMMIT /* XID */
#	#	Query	#	#	BEGIN
#	#	Table_map	#	#	table_id: # (test.t1)
#	#	Write_rows	#	#	table_id: # flags: STMT_END_F
#	#	Xid	#	#	COMMIT /* XID */
#	#	Query	#	#	BEGIN
#	#	Table_map	#	#	table_id: # (test.t1)
#	#	Update_rows	#	#	table_id: # flags: STMT_END_F
#	#	Xid	#	#	COMMIT /* XID */
#	#	Query	#	#	use `test`; ALTER TABLE t1 CHANGE complex_val string_val VARCHAR(99) NOT NULL
#	#	Query	#	#	use `test`; DROP TABLE `t1` /* generated by server */
