CREATE TABLE t1 (
id INT PRIMARY KEY,
old_value VARCHAR(50)
);
SELECT * FROM villagesql.custom_columns;
db_name	table_name	column_name	extension_name	extension_version	type_name	type_parameters
INSERT INTO t1 VALUES (1, '(0.0,0.0)');
SHOW CREATE TABLE t1;
Table	Create Table
t1	CREATE TABLE `t1` (
  `id` int NOT NULL,
  `old_value` varchar(50) DEFAULT NULL,
  PRIMARY KEY (`id`)
) ENGINE=InnoDB DEFAULT CHARSET=utf8mb4 COLLATE=utf8mb4_0900_ai_ci
ALTER TABLE t1 ADD COLUMN new_complex_value COMPLEX;
UPDATE t1 SET new_complex_value = VSQL_COMPLEX.COMPLEX::from_string(old_value);
ALTER TABLE t1 DROP COLUMN old_value;
SELECT * FROM villagesql.custom_columns;
db_name	table_name	column_name	extension_name	extension_version	type_name	type_parameters
test	t1	new_complex_value	vsql_complex	0.0.1	COMPLEX	{}
SHOW CREATE TABLE t1;
Table	Create Table
t1	CREATE TABLE `t1` (
  `id` int NOT NULL,
  `new_complex_value` vsql_complex.COMPLEX DEFAULT NULL,
  PRIMARY KEY (`id`)
) ENGINE=InnoDB DEFAULT CHARSET=utf8mb4 COLLATE=utf8mb4_0900_ai_ci
UPDATE t1 SET new_complex_value = '(1.0,2.0)' WHERE id = 1;
INSERT INTO t1 VALUES (2, '(3.5,-1.2)');
SELECT * FROM t1;
id	new_complex_value
1	(1,2)
2	(3.5,-1.2)
# Test MODIFY COLUMN: change COMPLEX from NULL to NOT NULL
ALTER TABLE t1 MODIFY new_complex_value COMPLEX NOT NULL;
SELECT * FROM villagesql.custom_columns;
db_name	table_name	column_name	extension_name	extension_version	type_name	type_parameters
test	t1	new_complex_value	vsql_complex	0.0.1	COMPLEX	{}
SHOW CREATE TABLE t1;
Table	Create Table
t1	CREATE TABLE `t1` (
  `id` int NOT NULL,
  `new_complex_value` vsql_complex.COMPLEX NOT NULL,
  PRIMARY KEY (`id`)
) ENGINE=InnoDB DEFAULT CHARSET=utf8mb4 COLLATE=utf8mb4_0900_ai_ci
SELECT * FROM t1;
id	new_complex_value
1	(1,2)
2	(3.5,-1.2)
# Test CHANGE COLUMN: rename while keeping COMPLEX NOT NULL
ALTER TABLE t1 CHANGE new_complex_value renamed_complex COMPLEX NOT NULL;
SELECT * FROM villagesql.custom_columns;
db_name	table_name	column_name	extension_name	extension_version	type_name	type_parameters
test	t1	renamed_complex	vsql_complex	0.0.1	COMPLEX	{}
SHOW CREATE TABLE t1;
Table	Create Table
t1	CREATE TABLE `t1` (
  `id` int NOT NULL,
  `renamed_complex` vsql_complex.COMPLEX NOT NULL,
  PRIMARY KEY (`id`)
) ENGINE=InnoDB DEFAULT CHARSET=utf8mb4 COLLATE=utf8mb4_0900_ai_ci
SELECT * FROM t1;
id	renamed_complex
1	(1,2)
2	(3.5,-1.2)
DROP TABLE t1;
SELECT * FROM villagesql.custom_columns;
db_name	table_name	column_name	extension_name	extension_version	type_name	type_parameters
include/rpl/deprecated/show_binlog_events.inc
Log_name	Pos	Event_type	Server_id	End_log_pos	Info
#	#	Query	#	#	use `test`; CREATE TABLE t1 (
id INT PRIMARY KEY,
old_value VARCHAR(50)
)
#	#	Query	#	#	BEGIN
#	#	Table_map	#	#	table_id: # (test.t1)
#	#	Write_rows	#	#	table_id: # flags: STMT_END_F
#	#	Xid	#	#	COMMIT /* XID */
#	#	Query	#	#	use `test`; ALTER TABLE t1 ADD COLUMN new_complex_value COMPLEX
#	#	Query	#	#	BEGIN
#	#	Table_map	#	#	table_id: # (test.t1)
#	#	Update_rows	#	#	table_id: # flags: STMT_END_F
#	#	Xid	#	#	COMMIT /* XID */
#	#	Query	#	#	use `test`; ALTER TABLE t1 DROP COLUMN old_value
#	#	Query	#	#	BEGIN
#	#	Table_map	#	#	table_id: # (test.t1)
#	#	Update_rows	#	#	table_id: # flags: STMT_END_F
#	#	Xid	#	#	COMMIT /* XID */
#	#	Query	#	#	BEGIN
#	#	Table_map	#	#	table_id: # (test.t1)
#	#	Write_rows	#	#	table_id: # flags: STMT_END_F
#	#	Xid	#	#	COMMIT /* XID */
#	#	Query	#	#	use `test`; ALTER TABLE t1 MODIFY new_complex_value COMPLEX NOT NULL
#	#	Query	#	#	use `test`; ALTER TABLE t1 CHANGE new_complex_value renamed_complex COMPLEX NOT NULL
#	#	Query	#	#	use `test`; DROP TABLE `t1` /* generated by server */
